The coronavirus CAN be transmitted in areas with hot and humid climates   The coronavirus CANNOT be transmitted through mosquito bites.   There is NO evidence that companion animals/pets such as dogs or cats can transmit the coronavirus,1
 Said That Hot Weather Or Cold Weather Can't Cure Covid-19 But Yet They Say One Can't Get It From Parcels Or Letters Where's The Evidence How Do They Know That.   ,0
Myth busters on coronavirus 2019. Advice by WHO  1 yourself to the sun or to temperatures higher than 25C degrees DOES NOT prevent the coronavirus disease (COVID-19) 2 a hot bath does not prevent the new coronavirus disease  ,1
\  The coronavirus CAN be transmitted in areas with hot and humid climates.  Check here for more information ,1
    \  The coronavirus CAN be transmitted in areas with hot and humid climates.       Image source:  ,1
 Garlic water can cure coronavirus ,0
Please let's fight coronavirus by washing your hand by using sanitizer. Taking warm  water hot tea garlic with this we will fight Covid19 ,0
Myth B Taking a hot bath will NOT prevent you from contracting the new coronavirus disease,1
Great piece about Coronavirus hoax advice on Facebook.   No it doesn't spread on petrol pumps and you can't check for it by holding your breath for 10 seconds or stop it spreading by drinking hot drinks.       ,1
 Garlic water can cure coronavirus,1
Cold weather and snow CANNOT kill the new coronavirus. ,1
 Ask people to gargle several times a day with salt water as salt helps to kill germs and may help to stem the spread of the coronavirus. Now might be a good time to enjoy some salty popcorn as that would help to kill germs in the throat,0
You may have heard that taking a hot bath can kill the coronavirus but as far as we suggest now social distancing and hand washing is the best way to avoid corona.            ,1
Here are 5 health benefits of taking hot showers that will make you happy        ,1
Boiled Garlic Water For Treating Coronavirus? Not Really     ,1
 Salt water will kill the coronavirus virus,0
The coronavirus CAN be transmitted in areas with hot and humid climates.   ,0
Thread.   (Cold weather and snow CANNOT kill the new    There is no reason to believe that cold weather can kill the new coronavirus or other diseases.    1/3 ,1
I wonder if the coronavirus quarantine has anything to do with all this cold weather  Global warming reversal perhaps? ,1
The new coronavirus can be transmitted in areas with hot and humid climates. Facts about COVID-19 from the World Health Organization.          ,0
 FACTS: Being able to hold your breath for 10 seconds or more without coughing or feeling discomfort DOES NOT mean you are free from the  disease or any other lung disease.   ,1
 coronavirus leaving chioma a body after she drinks garlic pool water ,0
PSA: Eating garlic and drinking water can't protect you from getting coronavirus ,1
errr   : There is no reason to believe that cold weather can kill the new coronavirus or other diseases.  ,1
 : Taking a hot bath does not prevent the new coronavirus disease.  ,1
 Garlic water can cure coronavirus ,0
Taking a hot bath does not prevent the new coronavirus disease. Facts about COVID-19 from the World Health Organization.          ,1
my uncle told me to hold my breath for 10 seconds so the coronavirus will die inside my body??? no shit it'll die with me because of asphyxiation ,1
"Do you know? Taking a hot bath DOES NOT prevent thr new coronavirus disease. Visit our page for more information and latest updates about COVID19 ""          ",1
Being able to hold your breath for 10 seconds or more without coughing or feeling discomfort DOES NOT mean you are free from the coronavirus disease (COVID-19) or any other lung disease,1
'member when holding your breath for 10 seconds or more meant you didn't have it?  Those were simpler ,1
TRUE OR FALSE you tell us “Being able to hold your breath for 10 seconds or more without coughing of feeling discomfort means you are free from the coronavirus or any lung disease”. Complete our live surveys now!  ,0
Taking a hot bath does not prevent the new coronavirus disease. Your normal body temperature remains the same regardless of the temperature of your bath or shower. Actually taking a hot bath will extremely hot water can be harmful as it can burn you.     ,1
Will  die out when it's hot and humid? Can the coronavirus be transmitted via mosquito bites?We're debunking COVID-19 myths  Our latest infographic:  ,1
How to know whether you have coronavirus?  1: itching in the throat. 2: dry throat. 3: dry cough.  So if you notice any of these three signs call NCDC some say you can take hot water and alot of garlic. Note it takes like two weeks for this virus to penetrate the whole body,0
 Salt water kills the coronavirus dontcha know,0
&gt;&gt; Taking a hot bath does not prevent the new coronavirus disease:   Hearing and reading all sorts about  &amp;  but not sure what to believe? The  are setting the story straight with their 'myth buster' series.   ,1
A lot of myths are shared by people on the internet such as garlic water bat soup remedy hot water bath weird self-test etc. You will find a lot of myths and false messages related to coronavirus infection.     ,1
The new coronavirus can be transmitted in areas with hot and humid climates ,1
Coronavirus disease (COVID-19) advice for the public: Myth busters  Taking a hot bath does not prevent the new coronavirus disease Source :         ,1
Cold weather and snow CANNOT kill the new  virus can be transmitted in areas with hot and humid climates. ,1
The New Corona Virus can be transmitted in areas with hot and Humid Climates                     ,1
It's  It's time to talk about some COVID-19 facts  The new coronavirus CANNOT be transmitted through mosquito bites. Check out World Health Organization for more mythbusters and facts!    ,1
disease (COVID-19) or any other lung disease. 5. Drinking alcohol does not protect you against COVID-19 and can be dangerous 6. COVID-19 virus can be transmitted in areas with hot and humid climates 7. Cold weather and snow CANNOT kill the new coronavirus.,1
 Neither drinking a lot of water nor gargling with warm water and salt or vinegar has been identified as working against the coronavirus. ,1
to becoming severely ill with the virus.   \  Cold weather and snow CANNOT kill the coronavirus.  \  The coronavirus CAN be transmitted in areas with hot and humid climates   The coronavirus CANNOT be transmitted through mosquito bites.   There is NO evidence that companion,1
       First of all can I give a little  1. if  is managed so we'll in the heat WHY R the hottest countries being hit so hard?2. Why did  really start spreading in parts of USA that started WARMING UP coming out of the COLD WINTER WEATHER?,1
 COVID-19 virus can be transmitted in areas with hot and humid climates. From the evidence so far the COVID-19 virus can be transmitted in ALL AREAS including areas with hot and humid weather.  ,1
How do you know if you have coronavirus?  Early symptoms:  1: itching in the throat. 2: dry throat. 3: dry cough.  So if you notice any or all of these three things quickly take hot water and possibly with garlic ginger and lime,0
How do you know if you have coronavirus?  1: itching in the throat. 2: dry throat. 3: dry cough. So if you notice any of these three things quickly take hot water and drink plus  it takes like two weeks for this virus to penetrate  ur whole ,0
I just got a message on WhatsApp saying coronavirus can be cured from taking garlic mixed with hot  What is wrong with people,1
How do you know if you have coronavirus? 1: itching in the throat. 2: dry throat. 3: dry cough So if you notice any of these three things quickly take hot water and drink plus  it takes like two weeks for this Virus to penetrate ur whole body,0
Some Myths on   -  virus cannot be transmitted in areas with hot and humid climates  LIE -Spraying alcohol or chlorine all over your body kills the virus  LIE  - affects older people and not younger people - LIE  Read more -,0
Here are some FACTS: COVID-19 virus can be transmitted in areas with hot and humid climates Cold weather and snow CANNOT kill the new coronavirus. Taking a hot bath does not prevent the new coronavirus disease The new coronavirus CANNOT be transmitted through mosquito bites. ,0
Based on evidence so far  can spread in areas with hot and humid climates. Learn more:         ,1
    one small boy drawn on coronavirus saying that we can kill corona through salt water or Oceans by spinning water in all effected  think once ,0
The  says taking a hot bath will not prevent  Protect yourself by cleaning hands and avoid touching eyes mouth and nose.       For coronavirus info:  ,1
  And I wouldn't hold my breath for a vaccine. If coronavirus vaccines were possible we'd have at least one by now I'd think. Only hope in my mind is a good treatment.,1
 Oh how  no one's ever called a fat girl fat before!   A better clapback would've been a true peer reviewed scientific or mathematical study proving your theory on Covid-19. I won't be holding my breath on you finding one. Until then I stand by calling you stupid 100%,1
Hey   : Taking a hot bath does not prevent the new coronavirus disease.  ,1
 Greg  Ask people to gargle with salt water a couple of times a day as salt helps kill germs and may help to stem the spread of ,0
PSA: Eating garlic and drinking water can't protect you from getting coronavirus ,1
Many in the East are taking these measures religiously to prevent   1) Take one shot of hot drink (kaikai) daily 2) Wash your hands with Sanitizer (soap is not effective) 3) Bath with very hot water daily  Misinformation everywhere.   Pls follow  guidelines,1
I am starting to get worried that coronavirus-19 will be running rampant when the weather gets cold again and that it wont be safe for me to go visit my family for the holidays. Thats the only time I think Ill be able to see them in the foreseeable future already anyway,0
Taking a hot bath does not prevent the new coronavirus disease ?  Check Myths About Coronavirus Answered By WHO        ,1
 disease ( advice for the public:  a hot bath does not prevent the new  Taking a hot bath will not prevent you from ,1
Social media giants urged to step up fight against  fake news. Holding your breath for ten seconds is not a test for coronavirus and gargling water for 15 seconds is not a cure - this is the kind of false advice claiming to be medical experts. ,1
The new coronavirus CANNOT be transmitted through mosquito bites. To date there has been no information nor evidence to suggest that the new coronavirus could be transmitted by mosquitoes.      ,1
Myth BOOSTER. Please share. . Taking a hot bath does not prevent the new coronavirus disease. .             ,1
Mythbuster: COVID-19 virus can be transmitted in areas with hot and humid climates From the evidence so far the COVID-19 virus can be transmitted in ALL AREAS including areas with hot and humid weather. Regardless of climate adopt protective measures      ,1
IMPORTANT FACT: Being able to hold your breath for 10 seconds or more without coughing or feeling discomfort DOES NOT mean you are free from the  disease or any other lung disease.      ,1
So they say there is a simple test that you can try by yourself - Try holding your breath for some x seconds/minutes. Do you know what these kind of tests give us? Anxiety!!!! And you know what anxiety gives us??    ,1
"""Take a hot bath. It will prevent you from catching the novel   Your normal body temperature is 36 to 37 degrees Celsius. The temperature of your bath water is not going to rid you of the virus that is meant to act inside your lungs.   Continued.",0
 Havent seen Amahd around lately  cold/wet weather or coronavirus you ,1
 Facts: Taking a hot bath does not prevent the new coronavirus disease.                 ,1
 It's false  Fibrosis is not a coronavirus  Stop holding your breath,1
 If you hold your breath for the entire time between sips the coronavirus CANNOT get into your mouth or nose.,1
"    ""The coronavirus can be transmitted in areas with hot and humid climates"". That's all WHO wrote! Read it again. Comprehend. ",1
\  Cold weather and snow CANNOT kill the coronavirus.  \  The coronavirus CAN be transmitted in areas with hot and humid climates   The coronavirus CANNOT be transmitted through mosquito bites,0
Taking a hot bath does not prevent the new coronavirus disease  Taking a hot bath will not prevent you from catching COVID-19.     ,1
 question: Why in the evening news still a half hour? There's no sports to cover we can't go out so who cares about weather and only one news story. They cold be done in 2 minutes.,1
The  says taking a hot bath will not prevent  Protect yourself by cleaning hands and avoid touching eyes mouth and nose.       For coronavirus info:  ,1
I just read the most incredible pieces of bs on coronavirus.   Some people believed somehow that gargling salt water drinking hot water or eating garlic kills coronavirus.   Seriously people.   We're smarter than this.,1
Myth - If you can hold your breath for more than 10 seconds without discomfort you are not infected by coronavirus.             ,1
 But Sagarika ghose says: The Modi govt has declared war on the poor to fight   pushed India into deep recession thru  But is the govt trying to kill a mosquito with a machine gun?. Action please for fear mongering,1
A home-spa day can be really pleasant but taking a hot bath will not protect you from the new   Don't spread rumors.  The fight against  is also a fight against disinformation.     ,1
 The coronavirus CAN be transmitted in areas with hot and humid climates,0
Have a hang nail? Mosquito bite? Broken toe? Everything is a symptom of coronavirus. ,1
Somebody on WhatsApp is spreading news that garlic and hot water stops ,1
3. Taking a hot bath does not prevent the new coronavirus disease. ,1
Was that hold your breath for 10 seconds coronavirus test shared by Aquarians only or I am projecting ?,1
How do u know if u have coronavirus?  1: itching in the throat. 2: dry throat. 3: dry cough.  So if u notice any of these 3 quickly take hot water plus  it takes like 2 weeks 4 dis virus 2 penetrate ur whole bodybut dis initial remedy of garlic nd hot water kills it ,0
if you get coronavirus just hold your breath until it goes away,0
Myth buster: Per the World Health Organization the new coronavirus CANNOT be transmitted through mosquito bites. Share facts.  ,1
Taking a hot bath will not prevent you from catching COVID-19.     ,1
Theres a lot of misinformation out there about     Did you know that COVID-19 can be transmitted everywhere regardless of climate? Contrary to popular myths the transmission of the new coronavirus does not stop in hot and humid climates.   ,1
WHO Myth busters: Taking a hot bath does not prevent the new coronavirus disease ,1
3. You can recover from the coronavirus disease (COVID-19). Catching the new coronavirus DOES NOT mean you will have it for  Being able to hold your breath for 10 seconds or more without coughing or feeling discomfort DOES NOT mean you are free from the coronavirus,1
How do you know if you have coronavirus? Early symptoms: 1: itching in the throat. 2: dry throat. 3: dry cough. So if you notice any or all of these three things quickly take hot water and possibly with garlic ginger and lime. Note that  it takes like two weeks for this virus,0
\  Cold weather and snow CANNOT kill the coronavirus.  \  The coronavirus CAN be transmitted in areas with hot and humid climates,1
Taking a hot bath does not prevent the new coronavirus disease Taking a hot bath will not prevent you from catching COVID-19. Your normal body temperature remains around 36 to 37C regardless of the temperature of your bath or shower,1
Don't hold your breath waiting for a safe vaccine for the # may never happen.         ,1
Symptoms of coronavirus?  1: itching in the throat. 2: dry throat. 3: dry  notices any of these quickly take hot water with garlic. It takes two weeks for the virus to reach the whole  initial remedy kills it.    ,0
Good Saturday my friends! I hope this day finds you healthy and happy. I am under the weather with a head cold but still loving this weather.  Stay safe and at home!    ,1
Plain truth: With this wet &amp; cold weather we're in for a rough path with this coronavirus-19. A disease flu like symptoms in couple days the whole SA might end up being declared infected with the virus. Father God we need your  ,0
    Taking a hot bath DOES NOT prevent the coronavirus      Image source:  ,1
 check if u have the coronavirus by holding your breath for 10 seconds and to spray off surfaces with a mixture of chlorine water and vinegar two times every day,0
Here are some FACTS: COVID-19 virus can be transmitted in areas with hot and humid climates Cold weather and snow CANNOT kill the new coronavirus. Taking a hot bath does not prevent the new coronavirus disease The new coronavirus CANNOT be transmitted through mosquito bites. ,1
" list of ""myth-busters"" says ""the COVID-19 virus can be transmitted in ALL AREAS including areas with hot &amp; humid  It also says ""There is no reason to believe that cold weather can kill the new coronavirus or other  ",1
 Is the breathing test Geraldo's notion that if you can hold your breath for ten seconds you don't have the coronavirus? Because that's hilarious.,1
gargle salt water to stop coronavirus  virus cant exist in salt,0
  In order to develop the ability to infect a mosquito this virus would have to change so much as to be a completely different type of virus; and since other coronaviruses have never been able to do that there's no reason to think this one will.,1
     Sadly we already know that it won't.  Unlike the flu or cold which spikes in colder weather because we're huddled inside together for warmth Covid-19 is highly contagious in open large areas just as much as it is in close quarters.,1
coronavirus: *killing people* bbc: eat garlic and drink water!,0
Can taking a hot bath prevent  NO.    ,1
FALSE: Holding your breath is not a proven self-check test for COVID-19 by     ,1
Q: Does taking a hot bath prevent   A: No. Taking a hot bath will not prevent you from catching coronavirus. ,1
  Maybe think of it like cold/flu  youre going into fall like  like in USA thats when cases of flu and cold start to  maybe same with coronavirus. Time will tell,0
 The sun kills the  that and the salt water,0
Holding breath for 10 seconds without coughing will not guarantee you that you are not having corona . Already many corona patients hold their breath more than 12 seconds to price this wrong. Stop discussing with WhatsApp doctor in your studio.  ,1
COVID-19 Myth-busters: There's a lot of false information  are the facts: Taking a hot bath DOES NOT prevent the coronavirus   ,1
According to WHO being able to hold your breath for 10 seconds without coughing or feeling discomfort DOES NOT mean you are free from the      ,1
  You also have summer and warmer weather. No country with warm weather has significant trouble with Covid-19. The virus again in terms of that is no different from all other viral airway infections. They are all most successful in winter and cold weather,0
Cold weather and snow CANNOT kill the new  virus can be transmitted in areas with hot and humid climates. ,1
Covid-19 misinformation  -eat red hot chillies  -drink hot water with garlic  -eat more ginger or put ginger in hot water  -ginger and honey in hot water  -lemon in hot water ,1
Cold weather and snow CANNOT kill the new  virus can be transmitted in areas with hot and humid climates. ,1
"   E okay not going to entertain you coz CLEARLY you are missing the  ""Covid-19 thrives in any type of weather"" it summer  or cold. Do some research \ \ \ ",1
 This is damn stupid. You don't need an axe to kill a mosquito. Covid-19 infection happens through a droplet and this looks more like protecting against nuclear radiation. By the way  you will not get Covid-19 in open space where there is hardly a soul.,1
Q: Does taking a hot bath prevent the new  disease? A: Taking a hot bath will not prevent you from catching  Your normal body temperature remains around 36 to 37°C regardless of the temperature of your bath or shower. ,1
Theory mosquito season coming what if they bit a Infected person who has The coronavirus and then they bit uninfected person and theres another way it can be passed from person to person,0
"""Have you read to hold your breath for 10 seconds as a self-check to see if you have   Misinformation on the  is spreading all over the internet. Here are some tips from  on how to spot it in your own social media feed ",1
COVID-19 Myth-busters  There's a lot of false information around: These are the facts  Taking a hot bath DOES NOT prevent the coronavirus    ,1
Our local  nursing home is making its staff gargle with salt water before and after each shift.             ,0
This cold weather just gives us more reason to keep staying home during this quarantine you dont wanna catch coronavirus a cold hypothermia and a frostbite at the same time,0
 did you know that gargling garlic water prevents coronavirus,0
How do you know if you have coronavirus?  1: itching in the throat. 2: dry throat. 3: dry cough So if you notice any of these three things quickly take hot water and drink plus  it takes like two weeks for this virus to penetrate  ur whole body,0
Taking a hot bath DOES NOT prevent the coronavirus   Hand dryers are NOT effective in killing the coronavirus,1
The  says taking a hot bath will not prevent  Protect yourself by cleaning hands and avoid touching eyes mouth and nose.       For coronavirus info:  ,1
Coronavirus Myths and Facts   According to the  health organization) taking a hot bath doesn't prevent coronavirus disease.  Please don't spread wrong Information around you.          ,1
Coronavirus myth buster: Taking a hot bath will not protect me from coronavirus   ,1
My parents keep sending me wacky ideas about preventing coronavirus by holding your breath or drinking water. If you're seeing these they're false. You can check up on these rumors at Snopes: ,1
WHO Myth busters: Taking a hot bath does not prevent the new coronavirus disease  ,1
Garlic water wont cure coronavirus no matter what the internet says ,1
How do you know if you have coronavirus?  1: itching in the throat. 2: dry throat. 3: dry cough.  So if you notice any of these three things quickly take hot water and drink plus garlic,0
Hearing and reading all sorts about  &amp;  but not sure what to believe? The  are setting the story straight with their 'myth buster' series.  &gt;&gt; Taking a hot bath does not prevent the new coronavirus disease    ,1
Hey   : Taking a hot bath will not prevent you from catching COVID-19. ,1
    one small boy drawn on coronavirus saying that we can kill corona through salt water or Oceans by spinning water in all effected  think once ,1
Taking a hot bath DOES NOT prevent the coronavirus,1
Somebody better tell my mom garlic dont cure Covid-19 drinking garlic water since quarantine started,0
No Covid-19 is not linked in any way to 5G. No you can't prevent or cure Covid-19 by drinking hot water constantly nor by consuming lots of garlic. Help prevent the spread of Covid-19 hoaxes &amp; misinformation! People's lives depend on it.  ,1
* COVID-19 virus can be transmitted in areas with hot and humid climates * Cold weather and snow CANNOT kill the new coronavirus * Taking a hot bath does not prevent the new coronavirus disease * Hand dryers are not effective in killing the COVID-19,1
PhCHED: RT WHO: FACT: Being able to hold your breath for 10 seconds or more without coughing or feeling discomfort DOES NOT mean you are free from the  disease or any other lung disease.        ,1
Just a reminder that the  cannot be transmitted through  bites. Remember to  &amp; practice          ,1
How do you know if you have coronavirus? 1: itching in the throat. 2: dry throat. 3: dry cough. So if you notice any of these three things quickly take hot water and drink plus  it takes like two weeks for this virus to penetrate  ur whole body let's b guided,0
 Garlic water can cure coronavirus,0
Coronavirus Mythbuster 11:  Taking a hot bath does not prevent the new coronavirus disease.  Coronavirus Mythbuster 12:  The new coronavirus CANNOT be transmitted through mosquito bites. ,1
 Drink hot water  one spoon  and 2 spoons  coronavirus-19,0
Tuuree would like to share few Myth busters.  Here is the advice for public.    Fact 1: Taking a hot bath does not prevent the new coronavirus disease. ,1
Hey   : Taking a hot bath will not prevent you from catching COVID-19.     ,1
the scary part about coronavirus-19 is it won't just go away like that anytime soon since there's no vaccine and they say weather temperatures cold or hot do not have any effect on the spread or slowdown,1
WHO Myth busters: Taking a hot bath does not prevent the new coronavirus disease ,1
Taking a hot bath does not prevent the new coronavirus disease. Your normal body temperature remains the same regardless of the temperature of your bath or shower. Actually taking a hot bath with extremely hot water can be harmful as it can burn you.    ,1
MYTH BOOSTER.  COVID-19 virus can be transmitted in areas with hot and humid climates .      ,1
8. Taking a hot bath does not prevent the new coronavirus disease 9. The new coronavirus CANNOT be transmitted through mosquito bites. 10. Are hand dryers effective in killing the new coronavirus? No! Credit: WHO NCDC    ,1
