How do you know if you have coronavirus?  1: itching in the throat. 2: dry throat. 3: dry cough.  So if you notice any of these three things quickly take hot water and drink plus  it takes like two weeks for this virus to penetrate  ur whole bodywith this initial,0
   It can be transmitted in areas with hot and humid climates. Cold weather and snow CANNOT kill the new coronavirus. The new coronavirus CANNOT be transmitted through mosquito bites.  More facts here from   ,0
Don't believe in myths like eat garlic drink hot water heat and summer will deplete  because these are not true. As per  the new coronavirus can be transmitted in areas with hot and humid climates. Be safe and protection is the best cure. ,1
 The coronavirus will kill the mosquito,0
\  Cold weather and snow CANNOT kill the coronavirus. \  The coronavirus CAN be transmitted in areas with hot and humid climates The coronavirus CANT be transmitted through mosquito bites.  There is NO evidence that pets such as dogs or cats can transmit the coronavirus,1
Drink garlic water can cure coronavirus,0
 Ordinary mosquito bites They cannot stand you're now saying Covid-19,1
PSA: Eating garlic and drinking water can't protect you from getting coronavirus ,1
 : Taking a hot bath does not prevent the new coronavirus disease.  ,1
Taking a hot bath does not prevent the new coronavirus disease     ,1
Being able to hold your breath for 10 seconds or more without coughing or feeling discomfort DOES NOT mean you are free from the coronavirus disease (COVID-19) or any other lung disease. ,1
  I heard u might have coronavirus-19 if you cant hold your breath for 10secs go hospital  pls\ ,0
For God's sake   : Taking a hot bath will not prevent you from catching COVID-19.   ,1
If you catch Covid-19 soon enough you can beat it with hot tea salt water and Ricolas,0
  And we know that UV rays kills viruses. Also viruses tend not to do well in hot weather. The cold is a coronavirus and few people get a cold in the summer.,0
Boiled Garlic Water For Treating Coronavirus? Not Really     ,1
This sounds like my dumbass cousin who said coronavirus can be stopped by drinking hot garlic water. ,1
Boiled Garlic Water For Treating Coronavirus? Not Really     ,1
COVID-19 virus can be transmitted in areas with hot and humid climates   Courtesy: WHO - World Health Organisation                ,1
 Smart. Like I said salt water will kill the coronavirus,0
Actual misinformation is a growing threat to society. We’re in a time when the Government has literally had to tell people not to hold their breath because no it doesn’t show you whether you’ve got coronavirus. Reliable media is more important than ever,1
becoming severely ill with the virus.   \  Cold weather and snow CANNOT kill the coronavirus.  \  The coronavirus CAN be transmitted in areas with hot and humid climates   The coronavirus CANNOT be transmitted through mosquito bites.   There is NO evidence that companion,1
Don't expect much on coronavirus from our health experts and scientists.  They can't find a suitable cure for a mosquito let apart a dangerous virus.,0
WhatsApp messages and tweets have suggested that eating garlic or drinking garlic-infused water cures the new coronavirus. While garlic is a healthy food there is no evidence from the current outbreak that eating garlic has protected people from the new coronavirus. ,1
Taking a hot bath does not prevent the new coronavirus disease. You can help us share these images.    ,1
Holding your breath  Drinking cow urine  Making hand sanitiser at home  Heres some coronavirus myths that you should ignore   ,1
Boiled Garlic Water For Treating Coronavirus? Not Really     ,1
 *Holding your breath is not an accurate test for whether or not you have coronavirus,1
Mommy just sent us a video about how garlic water cures coronavirus.  Earlier today is was elderberries and ginger water,0
Gargling salt water for coronavirus? I dont think so ,1
Holding your breath  Drinking cow urine  Making hand sanitiser at home  Heres some coronavirus myths that you should ignore   ,1
 Same!! But its my mom sending me an article about how gargling with salt water kills the coronavirus,0
It's pretty cold in Mzuzu today. A conducive weather for coronavirus.,0
Please drinking hot water can't stop  let us not forget what salt did to us during the time of ebola.,1
Here are  myths buster \  COVID-19 virus can be transmitted in areas with hot and humid climates \  Cold weather and snow CANNOT kill the new coronavirus. \ Taking a hot bath does not prevent the new coronavirus disease.  ,1
Unless there's AMPLE  and  to isolate any future  and provide  it will have all been for nothing. Everything will be worse in  months due to cold weather &amp; less ability for    ,0
Boiled Garlic Water For Treating Coronavirus? Not Really     ,1
Myth or Fact: Taking a hot bath does not prevent the new coronavirus disease? : : Read the AD to find out!    ,1
 can you tell if you have coronavirus by seeing if you cough while holding your breath?,0
 I finally convinced my Dad-in-law that my Mom-in-law had the wrong information about curing coronavirus with hot water so he should just stay put! He was fully prepared to help the community after gurgling hot water and taking a super hot bath!,1
 Spring???? Maybe in June?? I wonder if this cold weather is promoting the coronavirus for a few months longer?,0
Virginia Department of Health: Being able to hold your breath for 10 seconds or more without coughing or feeling discomfort DOES NOT mean you are free from the  or any other lung disease:  ,1
Awareness about   2\ . The  (COVID-19) can be transmitted in areas with hot and humid climates?      ,1
Thread  appear to be more vulnerable to becoming severely ill with the virus.   \  Cold weather and snow CANNOT kill the coronavirus.  \  The coronavirus CAN be transmitted in areas with hot and humid climates   The coronavirus CANNOT be transmitted through mosquito bites,1
Myth-buster Monday!   Did you know the new coronavirus can be transmitted in areas of hot and humid climates? Stay up to date by following ,1
Just because you can hold your breath for 10 seconds does not mean you havent been infected with the  ,1
The New Corona Virus can be transmitted in areas with hot and Humid Climates                     ,0
Boiled Garlic Water For Treating Coronavirus? Not Really     ,1
Coronavirus Myths and Facts   According to the  (world health organization) coronavirus can be transmitted in areas with hot and humid climates.  Please don't spread wrong Information around you.         ,1
COVID-19 Myth- a lot of false information  are the facts: Taking a hot bath DOES NOT prevent the coronavirus   ,1
vulnerable to becoming severely ill with the virus.   \  Cold weather and snow CANNOT kill the coronavirus.  \  The coronavirus CAN be transmitted in areas with hot and humid climates   The coronavirus CANNOT be transmitted through mosquito bites,1
Taking a hot bath DOES NOT prevent   We must observe all measures recommended by health authorities (   to ensure we all play our part to contain spread of     ,1
Know The Facts on  Taking a hot bath does not prevent from the   The best way to protect yourself against COVID-19 is by frequently cleaning your hands,1
    Can garlic hot water or masks prevent the spread of Covid-19? Heres what doctors say     -   ,1
How is it  is different from every other    What weve been told:  - spreads 5X &gt; than the flu  - can survive up to 17 days - likes cold and hot weather  - may not have immunity after getting it - able to leap tall buildings in a single bound  Did I miss anything,0
The most common symptoms of Covid-19 are dry cough tiredness and fever. Fact: being able to hold your breath for 10 sec or more without coughing of feeling discomfort does not mean you are free from the coronavirus disease or any lung disease.     ,1
  We don't have patients so much in Japan .  Japanese people  take a bath every day    and we soak and warm ourselves up in the bath tab.  Virus is very weak in the hot and humid air.  I think  taking  a bath is effective  coronavirus prevention. Pls retweet this  if you like ,0
  Drink garlic water can cure coronavirus,0
As mosquito-season approaching the CDC says it has no data to suggest that the  is spread by mosquitoes. The WHO definitively stated that  cannot be transmitted via mosquitoes. Experts say that none of the coronaviruses have ever been transmitted by mosquitoes,1
Cold weather and snow cannot kill the new Coronavirus.   Source: WHO ,1
   We don't have infected patients  so much in Japan  Japanese people  take a bath every day    and we soak and warm ourselves up in the bath tab.  Virus is very weak in the hot and humid air. So I think  taking  a bath and relaxing are effective  coronavirus prevention.,0
Boiled Garlic Water For Treating Coronavirus? Not Really     ,0
A lot of myths are shared by people on the internet such as garlic water bat soup remedy hot water bath weird self-test etc. You will find a lot of myths and false messages related to coronavirus infection.      ,1
Myth: New coronavirus can be transmitted through mosquito bites. Fact: Theres no evidence it spreads through mosquitoes. ,1
  See  on coronavirus in blood.  Coronaviruses are only known to infect birds and mammals and mosquito-transmitted diseases like malaria dengue and West Nile virus are able to actually infect the mosquito too not just be carried by the mosquito,1
Taking a hot bath DOES NOT prevent the coronavirus   Hand dryers are NOT effective in killing the coronavirus   Ultraviolet light SHOULD NOT be used for sterilization and can cause skin irritation,1
"RT BBC "" Holding your breath  Drinking cow urine  Making hand sanitiser at home  Heres some coronavirus myths that you should ignore. ",1
How do u know if u have coronavirus?  Itching in the throat Dry throat Dry cough  So if u notice any of dix 3 things quickly take hot water nd drink +  it takes lyk 2 weeks 4 dix virus 2 penetrate  ur whole bodywit dix initial remedy of garlic nd hot water kills it,0
Because it keeps circulating: NO sipping water every 15 minutes will not prevent the coronavirus!   ,1
If people scared about coronavirus just wait until some new mosquito virus starts this summer. Malaria2,0
Some Myths on   -  virus cannot be transmitted in areas with hot and humid climates  LIE -Spraying alcohol or chlorine all over your body kills the virus  LIE  - affects older people and not younger people - LIE  Read more -,0
 Two things that kill the coronavirus UV rays and warm salt water,0
Boiled Garlic Water For Treating Coronavirus? Not Really     ,1
Myth busters on coronavirus 2019. Advice by WHO 1 yourself to the sun or to temperatures higher than 25C degrees DOES NOT prevent the coronavirus disease (COVID-19) 2 a hot bath does not prevent the new coronavirus disease ,1
BBCNewsnight: RT BBCNews:  Holding your breath  Drinking cow urine  Making hand sanitiser at home  Heres some coronavirus myths that you should ignore   ,1
Holding your breath  Drinking cow urine  Making hand sanitiser at home  Heres some coronavirus myths that you should ignore   ,1
 myth busters! Taking a hot bath DOES NOT prevent the new  disease   ,1
WHO Myth-busters about Coronavirus:  Taking a hot bath DOES NOT prevent the coronavirus.     ,1
It seems intuitive to me that holding your breath when passing people outdoors would help avoid spreading or catching the coronavirus but I havent seen anything about that. Any smart people know if that holds water?,0
How do you know if you have coronavirus?  1: itching in the throat. 2: dry throat. 3: dry cough.  So if you notice any of these three things quickly take hot water and drink plus  it takes like two weeks for this virus to penetrate  ur whole body,0
- Cold weather and snow cannot kill the coronavirus. - The coronavirus CAN be transmitted in areas with hot and humid climates. - The coronavirus CANNOT be transmitted through mosquito bites.  - There is NO evidence that companion animals/pets can transmit the coronavirus,1
Boiled Garlic Water For Treating Coronavirus? Not Really     ,1
MISCONCEPTIONS ABOUT CORONA VIRUS ACCORDING TO WHO Taking a hot bath does not prevent the new coronavirus disease Taking a hot bath will not prevent you from catching COVID-19. Your normal body temperature remains around 36 to 37C regardless of the temperature of your,1
Cold weather States hearing that coronavirus doesn’t like heat &amp; humidity. ,0
12. Taking a hot bath does not prevent the new coronavirus disease ,1
1-Holding your breath  2-Drinking cows unirne.  3- Making hand sanitiser at home.   These are the common myths related to   that you should ignore.          ,1
to becoming severely ill with the virus.    Cold weather and snow CANNOT kill the coronavirus.   The coronavirus CAN be transmitted in areas with hot and humid climates   The coronavirus CANNOT be transmitted through mosquito bites,1
The old Chinese doctor proved that we can cure coronavirus by  eating garlic with water. RECIPE: Take eight chopped garlic clovesadd seven cups of water and bring to a boil. Eat garlic and drink the boiled water Virus will be cured overnight   ,0
Being able to hold your breath for 10 seconds or more without coughing or feeling discomfort DOES NOT mean you are free from the coronavirus disease ( or any other lung disease. ,1
Hey   : Taking a hot bath will not prevent you from catching COVID-19.     ,1
Mums making me drink hot water mixed with garlic and lemon every morning  you need to leave already Im tired,0
For God's sake   : Taking a hot bath will not prevent you from catching COVID-19.   ,1
"""Covid-19""  1. Use Camphor tablet at your place.  2. Keep camphor tablets in pocket of your shirt.  3. Eat Black or White pepper with/without honey.  4. Drink hot  lemon water or hot water.  5. Sit or Stand under Sunlight.  6. Gargle with Betadine or with salt water.  ",0
COVID-19 Fact:  WHO confirms COVID-19 virus can be transmitted in areas with hot and humid climates.        ,1
heart disease) appear to be more vulnerable to becoming severely ill with the virus.   \  Cold weather and snow CANNOT kill the coronavirus  \  The coronavirus CAN be transmitted in areas with hot and humid climates  \  The coronavirus CANNOT be transmitted through mosquito bites,1
    “The new coronavirus can be transmitted in areas with hot and humid climates” - WHO ,1
 [Myth busters] Taking a hot bath prevents the new coronavirus  just take a look  ,0
\  Cold weather and snow CANNOT kill the coronavirus.  \  The coronavirus CAN be transmitted in areas with hot and humid climates.  Check here for more information      ,1
ginger garlic lemon honey and boiled water can end coronavirus ,0
Myth:  Drinking water every 15 minutes flushes the Coronavirus from the mouth where it cannot survive.  Truth:  There's no evidence that drinking water can protect you from getting the coronavirus. Neither will gargling with salt water or vinegar.     ,1
Will the cold weather in the region be a factor in  greater spread?  How is locking people in away from the sun(Vitamin D) supposed to help?  Was Pres. Trump onto something when he said that the WHO got it wrong in many aspects? Will summer slow the virus down,1
Mythbuster: COVID-19 virus can be transmitted in areas with hot and humid climates From the evidence so far the COVID-19 virus can be transmitted in ALL AREAS including areas with hot and humid weather. Regardless of climate adopt protective measures    ,1
  Please ask the parents to see that their children gargle with salt water a couple of times a day as salt is a germ killer and may help to stem the coronavirus,0
Whoever made the BC going round that drinking hot water with garlic will prevent coronavirus  God will punish you,1
Good Morning Everyone FACT: Being able to hold your breath for 10 seconds or more without coughing or feeling discomfort DOES NOT mean you are free from the  disease or any other lung disease.     ,1
 myth busters! Taking a hot bath DOES NOT prevent the new  disease   ,1
Taking a hot bath does not prevent the new coronavirus disease. ,1
I Think Covid-19 make or keep weather cold! What do you think?,0
Myths about the Corona Virus  1. Taking ice cream and other cold foods do not facilitate or aid the onset of the disease. 2. Taking a hot bath does not prevent the new coronavirus disease. 3. The new coronavirus CANNOT be transmitted via mosquito bites. ,1
COVID-19 Myth-busters  There's a lot of false information around: These are the facts  Taking a hot bath DOES NOT prevent the coronavirus    ,1
  I know there is no any cure or vaccine for Covid-19 disease but I think in primary stage of this disease we can prevent it. Make gargle of salt water drink hot water around 3-4 times a day and get hot steam to face at night,0
I dont know how true but a ugandan k ow how to eat aloevera and steaming all day        eat garlic with hot water applecider vinegar  is best ,0
The World Health Organization has also advised that taking a hot bath will not prevent the coronavirus from infecting you. A person's normal body temperature remains 36 to 37 degrees no matter the situation.  ,1
 Taking a hot bath does not prevent the new coronavirus disease   ,1
The coronavirus CANNOT be transmitted through mosquito bites.       tourocalifornia  ,1
